{"evidence_index":[{"evidence_sha256":"6b1220404024629558afa73d0bc51833434c45b4d90bb41524723f0a7fcd0023","fact_id":"file:README.md","packet_sha256":"cfeb8f5d6102fe5274e491c2c7340d856be68187ea061bbdf7b3ea552df7d0fc"}],"locales":["en"],"mode":"readme","output_contract":{"forbidden_paths":[".env",".git/**",".omo/**","node_modules/**"],"required_files":["README.md","asset-manifest.json","claim-map.json"],"schemas":{}},"plan":{"commands":[],"diagram_route":"none","evidence_ids":["file:README.md"],"languages":["en"],"mode":"readme","schema_version":1,"sections":["overview"],"visual_intent":"project-structure"},"project_classification":"developer-tool","retrieval_records":[{"pattern":{"proof":"P","structure":"T","summary":"S"},"record_id":"higher","score":20},{"pattern":{"proof":"p","structure":"t","summary":"s"},"record_id":"lower","score":10}],"revision_context":null,"schema_version":1,"target":{"base_sha":"aaaaaaaaaaaaaaaaaaaaaaaaaaaaaaaaaaaaaaaa","repository":"owner/demo"}}
